{
  "enabled": true,
  "branch": "main",
  "remote": "origin",
  "trigger": "version-change",
  "version_file": "VERSION",
  "stage_mode": "all",
  "commit_message": "chore(release): v{version}",
  "commit_body_mode": "staged-summary",
  "commit_body_header": "Auto-generated change summary",
  "push_tag": false,
  "tag_name": "v{version}"
}
